no,nama_tempat,nama_reviewer,rating,tanggal,ulasan,jumlah_ulasan_reviewer,foto
1,N/A,Rifdah Salsabiila,5,44 menit lalu,"Pilihan gelato nya banyak, nggak cuma gelato, ada kopi dll. Makanan juga oke. Pelayanan oke banget, ada kak Diaz juga yang ramah banget. Rekomendasi buat yg lg di Jogja",N/A,Tidak
2,N/A,Dian Anggraini,5,59 menit lalu,"Banyak varian rasa yang enak pokonya must be try. Cozy banget buat tugas atau chill aja

Nice service from Diaz. Thanks",N/A,Tidak
3,N/A,Septiani Dahlan,5,1 jam lalu,"Untuk tempatnya sangat nyaman sekali , banyak spot buat fotonya untuk hunting. Gelatonya juga enak dan pelayananya mas diaz juga sangat ramah⭐️⭐️⭐️⭐️⭐️",N/A,Tidak
4,N/A,Dewi Diana,5,1 jam lalu,"so friendly pelayanannya .. bagus banget , n enak banget gelatonya . nyaman juga tempatnya 👍🏻👍🏻👍🏻👍🏻👍🏻",N/A,Tidak
5,N/A,Nataanataa,5,1 jam lalu,"Ambiencenya oke banget kami bisa chill ngobrol sambil makan gelato,,, sempet kaget karna servicenya oke banget dikasih free minum terusu kak diaz nya juga ramah nawarin buat clean up sama refill air buat kamii,, lov lov sekali,,",N/A,Tidak
6,N/A,Reggyna Cleosa Sukmono,5,1 jam lalu,"pelayanan dari kak diaz sangat memuaskan dan semua staff disini ramah, dan rasa dari gelatonyaa enakk dan pass, tempatnya juga nyaman dan worth it to visit here 🤩👍🏻",N/A,Tidak
7,N/A,Michelle Callista,4,2 jam lalu,"Gelatonya enak, servicenya bisa ditingkatkan lagi. Yang disampaikan karyawan sudah benar, tapi cara memyampaikannya yang kurang tepat. Overall oke, bolehlah balik lagi karena gelatonya.",N/A,Tidak
8,N/A,Gilda Atalia,5,2 jam lalu,"untuk rasa makanannya kebetulan nyobain gelato dan gelatonya enak, tempatny cozy dan cantik banget untuk nongkiii nongkii dan semuaa pelayanannyaa ramah bangett dann asikk bangettt!!! rekomenn bangett!!",N/A,Tidak
9,N/A,Ribka Kesya,5,2 jam lalu,"5/5
Wajib banget dikunjungin kalo dateng ke Jogja!
Variant gelatonyaa buanyak banget, berkali"" kesini ga akan bosen dan pastinya rasanya enak bangett. Dan pastinya tempatnya cozy banget buat nongkrong cantikkk!! Paling penting kakak""nya ramah"" banget terutama kak diaz yang nawarin kitaa minummm hahahaha.",N/A,Tidak
10,N/A,kafabih Abdullah,5,9 jam lalu,"Gelatonya luar biasa. Banyak sekali jenisnya. Karyawannya rajin bgt,dibersihin mulu sampai kinclong. Rasa gelato nya enak. Gak terlalu manis. Rasa macha enak. Pas gak terlalu pahit dan manis. Kopi juga lumayan enak. Cuma kopi nya udah gelas kecil gak penuh pula. Kenapa es nya gak sekalian di penuhi. Aja",N/A,Tidak
11,N/A,Customized Official,5,9 jam lalu,"Gelato buka 24 jam cuma di sini, harga terjangkau, enak dan banyak pilihannya",N/A,Tidak
12,N/A,Yohana Eka,5,1 hari lalu,"Klo pgn gelato malem” ya kesnii soalnya 24 jam! Ada kopiii juga buat yg ga suka es krim”an, spot foto banyak !",N/A,Tidak
13,N/A,Nurul Nisa,5,1 hari lalu,"Tempatnya bagus banget, pelayanannya ramah dan sangat informatif, dan kids friendly sekali untuk anak saya yang super aktif dan ramah. Teruntuk mas Diaz sebagai GRO luar biasa.. terima kasih yaa atas keramahannya..",N/A,Tidak
14,N/A,Liza Anindya,5,1 hari lalu,"Pengalaman baruku!
Bagus ♡♡♡♡
~alfi",N/A,Tidak
15,N/A,AtiRra LatiFa,5,1 hari lalu,"nyam enak banhet matcha kyoto nya, naksir 😳 pelayanan nya ramah jugaaa worth to visitt",N/A,Tidak
16,N/A,Naufallino,5,1 hari lalu,"tempat nya nyaman sekalii dan minuman nya juga enakk
ka alfii nya juga ramah sekalii",N/A,Tidak
17,N/A,Jessica Dagur,5,1 hari lalu,"Salted caramelnya enak

Alfi",N/A,Tidak
18,N/A,Adelia Agustin,4,1 hari lalu,"pelayananya sangat baik dan ramah makanya juga enak enak
alfi",N/A,Tidak
19,N/A,Salma Aqiila,5,1 hari lalu,"udah berkali kali kesini, pelayanannnya mantap. terutama mas diaz 👋🏻",N/A,Tidak
20,N/A,Travish sekop,5,1 hari lalu,"Pelayanan baik dan nyaman, terimakasih kak diaz",N/A,Tidak
21,N/A,Risnah Risnah,5,1 hari lalu,"Tempatnya sangat nyaman dan varian gelatonya juga enak2, selain gelato juga ada snack & minuman 😍
+ GRO mas diaz ramah banget",N/A,Tidak
22,N/A,An Nastasya,5,1 hari lalu,"Ruangan yang bersih, tempat yg nyaman.
Pelayanannya sangat ramah, tepat waktu, dan hamble ☺️
Terimakasih kak diaz 🤝🙏🏻semangattttt",N/A,Tidak
23,N/A,Mursalin Mayah,5,1 hari lalu,"suasana enak, pelayanannya bagus namanya mas diaz",N/A,Tidak
24,N/A,Dea Salsaa,5,1 hari lalu,"rasa gelatonya enakk, pelayanannya super ramah apalagi sama mas diaz joss",N/A,Tidak
25,N/A,Eva Agustina,5,1 hari lalu,"gelato nyaa enakkk, pelayan ramahh polll yang namanya mas diaz mantap",N/A,Tidak
26,N/A,Aylin Shafiya A,5,1 hari lalu,sangat nyaman dan pelayanan ramah,N/A,Tidak
27,N/A,ᄏᄋ,5,1 hari lalu,"pelayanannya kak alfi ramah dan worth it banget tempatnya, harga juga affordable kokk",N/A,Tidak
28,N/A,Latifah Mutiara,5,2 hari lalu,"enak gelatonya, recommended 🤩.  pelayanannya bagus & ramah. thanks kak alfi",N/A,Tidak
29,N/A,Kaisha Alleyda,5,2 hari lalu,"Seru dan embience cafenya seru, thank you kak alfi",N/A,Tidak
30,N/A,Garneta Prameswari,5,2 hari lalu,Gelato yang wajib dicoba di kota ini,N/A,Tidak
31,N/A,Nur Indah Masita,5,2 hari lalu,"Tempat nyaman, pelayanan memuaskan terutama untuk mas diaz, makanan enak terutama untuk browniesnya, ada mushola dan tolietnya bersih, rekomended😍👍 …",N/A,Tidak
32,N/A,Syavira Anggelicha,5,2 hari lalu,"pelayanan mas diaz gacor parah!, ambience michael kreme jg oke bgt. worth the hype!!",N/A,Tidak
33,N/A,chelles core,5,2 hari lalu,"all good, service nya ok bgt mas diaz ramah",N/A,Tidak
34,N/A,ish,4,2 hari lalu,"Enak, tapi menurut saya sedikit mahal dan sorbetnya rasanya cukup ganggu di tenggorokan kayak ganjel gt.",N/A,Tidak
35,N/A,nana bilabila,4,2 hari lalu,"nyaman, pelayanan baik👍

#alfi",N/A,Tidak
36,N/A,mllna ekaa,5,2 hari lalu,Niceee #alfi,N/A,Tidak
37,N/A,Adelia grande,5,2 hari lalu,"Pelayanannya oke bgt sihh kak diaz,gelatonya mantap euy",N/A,Tidak
38,N/A,babyglohss_,5,2 hari lalu,"enak bangettt gelatonya manisnya pas, tempatnya oke juga luas, pelayanannya bagus, ramah terutama mas diaz",N/A,Tidak
39,N/A,Rossa Indira,5,2 hari lalu,"tempat nongkrong yg nyaman dan menu yg sangat menarik bikin ngga boring buat nongki

alfi",N/A,Tidak
40,N/A,I_34_Najwa Atikah,5,2 hari lalu,"gelatonya enak, banyak varian rasa juga",N/A,Tidak
41,N/A,Fitria Alviersty,5,2 hari lalu,"teguk, teruskan",N/A,Tidak
42,N/A,Annisa Rahmadania Agustin,5,2 hari lalu,"enakk, worth it gelato in jogjaa!!

alfi",N/A,Tidak
43,N/A,Yuli Antik,5,2 hari lalu,"Nuansa dan suasana baru di jogja yang boleh dicoba untuk dikunjungi. Ada kak diaz yang melayani customer dengan ramah dan sopan, membuat nyaman.",N/A,Tidak
44,N/A,Suci Dian,5,2 hari lalu,Gelatonya enak dan tempatnya nyaman. Pelayanan kak diaz sangat ramah dan sopan,N/A,Tidak
45,N/A,Cinta Widie Kusuma Putri,5,2 hari lalu,"tempatnya estetik pelayanan oke bgt, apalagi mbak alfi",N/A,Tidak
46,N/A,Dia Andini,4,2 hari lalu,"tempatnya lucu, service nya juga oke, apalagi mba alfi kasi kita minum gratis",N/A,Tidak
47,N/A,Nisa Azizah,5,2 hari lalu,"Cozy bangett, harga standar, spot foto semua, bersih, pelayanan okee
Terimakasih kak alfi sudah bantu fotokan kami 🥰🙌🏻",N/A,Tidak
48,N/A,Dwi Safitri,5,2 hari lalu,"Gelato murah tp rasanya ga kalah saing banyak berbagai macam variant. pelayanan yang super duper baik bgtt, ditambah ketemu server atas nama kak Alfi yang super ramah poll dan baik bgt krn mau ngefotoin walaupun berkali-kali 😍😍😍",N/A,Tidak
49,N/A,Ecak,5,2 hari lalu,"pelayanan oke by kak alfi tempat juga oke, harga terjangkau 👍",N/A,Tidak
50,N/A,Elvina Anggraini,5,3 hari lalu,"segi cita rasanya enak, masih ramah dikantong, untuk pelayanannan kak diaz ramah sekalii worth it baguss bgt layanananya",N/A,Tidak
51,N/A,Ardelia Ivanka,5,3 hari lalu,"Matchaa enakkeunn, Service nya bintang 10 dari kak diaz wkwkwk lucuu, naikin gajinya pliss",N/A,Tidak
52,N/A,Fermia Dela,5,3 hari lalu,Pelayanan dari kak Diaz okeee 👍,N/A,Tidak
53,N/A,Pratiwi Putri,4,3 hari lalu,"Pertama kali ke gelato michele creme sangat menarik dan emneyenangkan. Suasananya menarik dan gelatonya seger dan enak, untuk makanannya siddnya masih bisa diperbaiki lagi tapi masih terbilang enak. Pelayanan servee dan lainnya nyaman, ramah, dan menyenangkan tertutama kak alvi yang membantu dalam serving makanan dan kak diaz yang memberikan informasi yang sesuai dan ramah. Recommended banget!!",N/A,Tidak
54,N/A,Zahira Salsabila,5,3 hari lalu,"Gelato banyak varian dan enak enak
Pelayanan kak dias dan alfina oke banget, sempet ada salah menu tp penangannya cepat dan baik",N/A,Tidak
55,N/A,Octavia Carolline,5,3 hari lalu,Tempat yang bagus dengan rasa yang enak dan pelayanan yang baik juga 🤍,N/A,Tidak
56,N/A,namira uut,5,3 hari lalu,Citaa rasaa es krim yg beda dri es krim lain yg udh pernah aku cobain🥰 ee krimnya ngga lengket🫶🏻 layanannya juga warm bgt terutama kak Diazz berasa menikmati es krim sambil teater😆🫶🏻🫶🏻,N/A,Tidak
57,N/A,banditos Land,5,3 hari lalu,"best gelato in town, pilihan rasanya banyak dan enak enak semua, buka 24 jam",N/A,Tidak
58,N/A,nabhita maulia,1,3 hari lalu,Mas mas yg ngarahin parkir ato satpamnya itu yg di es maupun resto depannya bad attitude banget. Udh kesel emosi panas2 gak jadi makan es krim gara2 pelayanan yg gak banget sekelas cafe dan resto yang wow ternyata gak menjamin crewnya.,N/A,Tidak
59,N/A,Yunita Laila Nur Azizah,4,3 hari lalu,N/A,N/A,Tidak
60,N/A,Naili Rintan Kurniasari,5,3 hari lalu,Pelayanan nya bagus bgt oleh kak Diaz keren bgt semangat bgt pelayanan nya ramah bgt juga suka🫶🏻,N/A,Tidak
61,N/A,Syahid Suplek,5,3 hari lalu,"pelayanan dari kak diaz oke banget, perfect pokoknya",N/A,Tidak
62,N/A,Salsabila Ardelia,5,3 hari lalu,"tempatnya nyaman, pelayanannya sangat baik, di service dengan baik. untuk kak diaz bikin nyaman dan lucu!! Jadi nyaman buat nongkrong, minumannya enak dan gelatonya top!!",N/A,Tidak
63,N/A,Renni Rahmadani,5,4 hari lalu,tempat yang bagus untuk nongkrong pelayanan kak diaz juga baik dan menerima untuk kritik sarannya semog berkembang makin baik.,N/A,Tidak
64,N/A,Noor Anisa,5,4 hari lalu,"Mantaaap, tempat dan rasanya enak. Kami coba gelato dan chiken wings nya. Enak. Banget ☺️ dilayanin ama kak Diaz, ramah banget.",N/A,Tidak
65,N/A,Fitri Ana Dwi Kurniawati,5,4 hari lalu,"Rasnya enak, tempat sangat luas dan nyaman. Kakak kakaknya sangat ramah, terutama kak Diaz yang sangat informatif, ramah dan sangat membantu ✨",N/A,Tidak
66,N/A,Nur Sesa Oktavia,5,4 hari lalu,"Variasi es banyak, tempat sangat nyaman luas dan designnya lucu, kakak kakaknya sangat ramah, terutama kakak Diaz yg sudah menawarkan minuman dan password wifi",N/A,Tidak
67,N/A,Dika Kartika Oktaviani,5,4 hari lalu,"Tempat makannya aestetik, rasa es krimnya enak, pelayanan dari kak diaz sangat ramah dan membuat nyaman",N/A,Tidak
68,N/A,Zahra Fadilla Ekasuci,5,4 hari lalu,"Es krimnya enak banget dan harganya terjangkau 💜 Pelayanan juga ramah serta tanggap, terima kasih mas Diaz 🙌",N/A,Tidak
69,N/A,Shikari Watanabe,5,4 hari lalu,"Gelatonya banyak varian dan affordable. Venue juga comfy dan eye catching

-Served by diaz",N/A,Tidak
70,N/A,renata alexandra,5,4 hari lalu,"Enak banget tempatnya comfy, pelayanan dari kak diaz juga ramah dan makanan apalagi gelato nya enak enak. Bakal kesini lagi deh!!",N/A,Tidak
71,N/A,Raja,5,4 hari lalu,"sangat baik dalam melayani dan tempatnya sangat menarik

~yang melayani diaz",N/A,Tidak
72,N/A,ghina nisa,5,4 hari lalu,"Pelayanan dari mas Diaz sangat memuaskan, pelayanannya ramah, bagus. Makanan dan minumannnya enak enak bangettt, gelato nya jg bervariasi rasa rasa nyaaa",N/A,Tidak
73,N/A,aura prasetya,5,5 hari lalu,"Tempatnya cozy dan suka banget sama pelayanannya, makasih ka diaz suka dan ramah banget",N/A,Tidak
74,N/A,sekar rahmawati,5,5 hari lalu,"untuk rasa gelatonya enak dan ambience cafe seru dan nyaman, untuk ka Diaz pelayanananya super ramah dan baik bangettt",N/A,Tidak
75,N/A,Talitha Salsabila,5,5 hari lalu,"Pesan rasa dark choco sama strawberry cheesecakena, enak, gak terlalu manis, waffle conenya juga enak bgt gak yang plain gitu. Pelayanannya juga baik, Kak Diaz ramah banget, sukses terus kak",N/A,Tidak
76,N/A,Laura Kusumawati,5,5 hari lalu,"Gelatonya enak, tempatnya nyaman, pelayanannya juga okeee bgtt, kaka2nya ramahh puoll, terutama kak diaz, dapet free air mineral jugaa",N/A,Tidak
77,N/A,Agatha Retno Pinasti,5,5 hari lalu,"rasa gelatonya enakk!! servicenya juga great! ramah banget kak diaz, suasananya juga estetik banget~",N/A,Tidak
78,N/A,Nirmala Aninditya,5,5 hari lalu,"worth the price bgtttt soalnya rasa sama fasilitas yang disajikan oke bgt, bisa buat nongkrong sambil mam eskrimmm, apalagi pelayanannya terutama dari kak diaz oke bgttt🤩🤩🤩RECOMENDEDDD!!!",N/A,Tidak
79,N/A,Isnaini Febriandini,5,5 hari lalu,varian gelato banyakk🥰 kak diaz pelayannya baik dan humble 😍 …,N/A,Tidak
80,N/A,MELMAN GLORY,5,5 hari lalu,"Suka sama gelato inii...
Banyak varian dan enak semua
Staff sangat ramah dan helpful
Tempat sangat nyaman. Ac adem
Betah berlama² disini",N/A,Tidak
81,N/A,Yatari Putri,5,5 hari lalu,"Enjoyyy! (Tagline nya Michael Kreme terngiang-ngiang).

Variannya banyak, tekstur creamyy, dan paling penting ga terlalu manis. Jadi ga terlalu merasa bersalah.
Servicenya juga oke. Dibantu sama Mas Diaz yg ramah puoll..",N/A,Tidak
82,N/A,Siti Lizaria Ardianti,5,5 hari lalu,"Rasanya tidak terlalu manis, rasanya creme sekali, pelayanan ramah @ diaz",N/A,Tidak
83,N/A,Adellia Rahmawati,5,5 hari lalu,"gelatonya enak, pas rasanya, staf atas nama diaz ramah bgt",N/A,Tidak
84,N/A,Araafanyalic Zeffalo 'Slr,5,5 hari lalu,"Tempat nya bagus, rasanya enak, mas diaz juga baik bgtt.
Luvv🤞🤞",N/A,Tidak
85,N/A,Iinicipa A,5,5 hari lalu,"gelatonya enak pas banget ga gampang mencair, untuk tempatnya banyak sekali spot foto estetik terus ada mas Diaz yang ramah sekali selaku GRO disinii bintang 5 deh 🤩 …",N/A,Tidak
86,N/A,Lenny Kaka,5,5 hari lalu,"Pelayanan bagus rasa enak
Mas diaz mantap",N/A,Tidak
87,N/A,Tempat Penyimpanan,5,5 hari lalu,"Lucu tempatnya, gelatonya banyak varian, sayang banget cuma bisa taste test 2 rasa. Jadi gatau yg enak apa. Untuk rasa ok",N/A,Tidak
88,N/A,Reza Aditya,5,5 hari lalu,"Tempat parkirnya luas, harga pas, jadi makannya puas",N/A,Tidak
89,N/A,silvia maharani,5,5 hari lalu,Terbaik,N/A,Tidak
90,N/A,zahira,5,5 hari lalu,N/A,N/A,Tidak
91,N/A,Yohannes Utomo,5,5 hari lalu,"Gelato enak, tempat luas. Cukup banyak tempat untuk yg suka berfoto",N/A,Tidak
92,N/A,Deby Melisa,5,5 hari lalu,"Ini kunjungan pertama saya ✋
Anda mendapatkan gelato yang sangat enak dengan harga yang sangat murah, tempatnya bagus, suasananya nyaman, dan stafnya sangat ramah 👍🏻",N/A,Tidak
93,N/A,Yeni Wahyuningsih,5,5 hari lalu,Tempatnya cozy sama gelatonya oke banget✨💯,N/A,Tidak
94,N/A,Rara,5,5 hari lalu,"tempatnyaa enak, pelayanannya ramah"" banget🥰",N/A,Tidak
95,N/A,mickey mouse,3,5 hari lalu,"🛕Segi tempat :  nyaman, luas, dan jika membawa keluarga tempatnya mencukupi.
🧀Segi makanan : cheese cake perpaduan manis dan gurihnya cukup, sedikit terlalu padat untuk texture kuenya. Namun enak dan bisa dinikmati.
🍨Segi gelato : untuk rasanya cenderung manis-manis. Tapi lengkap untuk varian rasanya dari buah-buahan dan yang perpaduan dengan susu. Untuk Kyoto Matcha, Pistachio, dan Ferrero enak-enak semua. Karena ada rasa pahit Kyoto Matchanya bisa netralkan rasa manis dari varian gelato lainnya. The best Kyoto Matcha nya 👍🏻👍🏻👍🏻
🙋🏻‍♂️Segi service staff : Jujur pelayanan dari karyawannya kurang memuaskan. Dari pengalaman saya pribadi, saya datang bersama keluarga dan semua beli gelato, coffee, dan pastry. (Walaupun tidak semua saya post fotonya)
Pelayanan karyawannya tidak baik kepada customer judes dan jutek, bahkan whispering ke sesama staff yang sedang melayani dan didepan customer.  “The staff are not trained properly.” Terutama mas yang postur tubuhnya paling tinggi diantara lainnya, juga karyawan perempuan yang berjilbab.
Justru yang paling baik saat itu adalah karyawan yang sedang training.
Saya pesan MK Signature dengan 3 rasa. Pertama gelato saya diambilkan oleh karyawan training, kemudian diambil alih karyawan perempuan yang berjilbab.
Jelas karyawan training baru mengambilkan 1 rasa. Dan dia si perempuan mengambilkan rasa gelato pilihan yang kedua. Dari sini dia menipu saya mengatakan gelatonya sudah semua.
Saya baru menyebut 2 rasa, tapi karyawan perempuan itu menyudahi dan bilang sudah cukup. Jelas saya belum mendapatkan varian pilihan yang ke 3.
Kenapa karyawannya dilatih untuk tidak berkata jujur?
Disini customer itu membeli bukan meminta.

Bagi saya cukup sekali saja kesini, jujur sangat-sangat kecewa dengan pelayanan karyawan dibagian gelato.

Untuk bagian coffee dan pastry, sudah sangat baik pelayanannya.

Tolong diperbaiki manner para karyawan di bagian gelato.
Sayang sekali tempatnya sudah sangat nyaman dan lengkap. Tapi citranya dirusak oleh segilintir karyawan yang pelayanannya kurang baik.",N/A,Tidak
96,N/A,Desty P,5,5 hari lalu,Nice ambience! The gelato is worth the price! Murah tp ga murahannn.. kok bisa sihh 😍,N/A,Tidak
97,N/A,Jessy Magdalena,5,5 hari lalu,Tempat nya sangat nyaman buat nongki nongki bareng keluarga. Gelato nya juga enak top markotop...,N/A,Tidak
98,N/A,haya aribah,5,5 hari lalu,N/A,N/A,Tidak
99,N/A,Nafisajida,5,5 hari lalu,N/A,N/A,Tidak
100,N/A,Chriszella Dusay,5,5 hari lalu,"Tempatnya nyaman, layanannya bagus, dan saya suka rasa Pistachio sangat rekomend.",N/A,Tidak
101,N/A,Merlin Mei Yotha,5,5 hari lalu,"Aku melihat tempat ini di TikTok dan karena aku suka gelato, aku memutuskan untuk mengunjungi tempat ini dan aku menyukainya, rasa andalannya benar-benar enak, mungkin aku akan mengunjungi tempat ini lagi di masa depan.
Ngomong-ngomong, Mas Diaz memberi kami segelas air, dia orang yang baik.",N/A,Tidak
102,N/A,Destya Golioth,5,5 hari lalu,N/A,N/A,Tidak
103,N/A,Monica Tatiana,5,5 hari lalu,"Ketiga kali ke sini dan selalu happy karena gelatonya enak pwol 🍦 & pelayanannya bagus banget, terutama Mas Diaz (GRO Michael Kreme) yg ramah 😍 Btw rasa favoriteku Match Pistachio ✅",N/A,Tidak
104,N/A,Nur Hasna Nafiisah,5,5 hari lalu,"Gelatonya terbaikkk, tempatnya nyaman buat ngobrol, mas Diaz (GRO) ramah sekaliii baikkk bangetttt 😍✨",N/A,Tidak
105,N/A,Novianti Ika Widyaningsih,5,5 hari lalu,Kak Diaz ramah dan melayani dengan baik,N/A,Tidak
106,N/A,Mochammad Hanif Ramadhan,5,6 hari lalu,"Tempatnya nyaman, harga gelatonya juga terhitung murah. Pelayanannya ramah, dilayani oleh mas Diaz",N/A,Tidak
107,N/A,RACHMA NUR HIDAYANTI,5,6 hari lalu,"Michael Kreme Gelato mah gak pernah miss — gelatonya creamy parah, plus staffnya sooo friendly & helpful Mas Diaz.. Pelayanannya prime banget, vibes-nya bikin balik lagi tanpa mikir!",N/A,Tidak
108,N/A,Lisa Darmawanti,5,6 hari lalu,"Tempatnya nyaman, pelayanan ramahh ❤️",N/A,Tidak
109,N/A,Laila Nurrahmah,5,6 hari lalu,Pelayanan sangat ramahh,N/A,Tidak
110,N/A,Anindita Nawangsari,5,6 hari lalu,"Eskrimnya enak, makanan lain juga enaakk. pelayanan ramah terutama mas dias, suasananya oke. Pokoknya mantap👍",N/A,Tidak
111,N/A,31. Endang Sukmawati,5,6 hari lalu,"Menunya enak, suasananya nyaman, pelayanannya juga ramah terutama untuk mas Dias.",N/A,Tidak
112,N/A,Retno Delia,5,6 hari lalu,"eskrimnya enakk tidak enegg sama sekalii, apalagi varian buahnya seger bangetttt… tempatnya aesthetic dann nyaman.. banyak spot foto yang gen z banget…
btw kak diaz salah satu pegawainya juga ramah sekali, thank uu kakkk",N/A,Tidak
113,N/A,Melia Fransiska,5,6 hari lalu,"es krim nya seger, tempat yang fancy, juga crew yang sangatt ramah bangettt",N/A,Tidak
114,N/A,Rizal Wahyu Pangestu,5,6 hari lalu,N/A,N/A,Tidak
115,N/A,Buyung Wahyu H.,4,6 hari lalu,N/A,N/A,Tidak
116,N/A,Retno Intansari,5,seminggu lalu,Atmosfer yang baik,N/A,Tidak
117,N/A,Maulidaninta Nayla,5,Diedit seminggu lalu,es creamnya enak dan tempatnya pw,N/A,Tidak
118,N/A,Tabita,5,seminggu lalu,"mbaknya ramahh, gelatonya enak apalagi yang pistachio sama rujak kweni💯",N/A,Tidak
119,N/A,Tiffany Victoria,5,seminggu lalu,"mba""nya baiiikk bangettt dan ramahh bgtt, duh bintangg 5🌟🌟🌟🌟🌟",N/A,Tidak
120,N/A,prisca putri,5,seminggu lalu,selalu kesini tiap craving ice cream dan tempatnya super nyaman,N/A,Tidak
121,N/A,Alisa Dwi Cantika,5,seminggu lalu,"Gelatonya enak banget, teksturnya halus dan gampang meleleh di mulut. Rasa coklatnya rich, tapi tetap ringan. Untuk yang fruity juga seger, kayak bener-bener dari buah asli. Tempatnya bersih, pelayanannya ramah, dan harganya masih masuk akal. Worth it buat dikunjungi lagi.",N/A,Tidak
122,N/A,Mifta nur Budiyanti,5,seminggu lalu,"Tempatnya bestt banget buat nongkrong, pelayanan juga okee bangett dibantu sama kak indah… tempat duduknya juga banyak dan parkiran luas",N/A,Tidak
123,N/A,strvngrrr 06,5,seminggu lalu,"gelato enak recomend buat anak² , karna enak ga sempet foto wkwkkw",N/A,Tidak
124,N/A,aka cupu,5,seminggu lalu,Pelayanan kak Darel dan indah oke banget,N/A,Tidak
125,N/A,ardiansyah,5,seminggu lalu,mas darel dan mba indah terbaik pelayananya,N/A,Tidak
126,N/A,Yenni Fatma,5,seminggu lalu,Pelayanan darel dan indah baik disini dan makanannya enak2,N/A,Tidak
127,N/A,Elsa Guntari,5,seminggu lalu,"Tempatnya estetik, so far setiap lokasi bisa banget buat foto"" dan pilihan gelatonya banyak variannya, gelatonya juga enakk🫶🏻",N/A,Tidak
128,N/A,Stella Nadia,5,seminggu lalu,Kegembiraan kecil hadir dalam bentuk sendok.,N/A,Tidak
129,N/A,crazy little thrift,5,seminggu lalu,🫰🏻🥰,N/A,Tidak
130,N/A,48 Christoporus Alrivano,5,seminggu lalu,Enak dan lezat,N/A,Tidak
131,N/A,Monicha Shinta,5,seminggu lalu,mantap toppp is the bestt🤩👍🏻,N/A,Tidak
132,N/A,Sherly Primavita,5,seminggu lalu,"Tempatnya enak banget buat nongkrong, kids friendly, gelatonya enak🥰🥰",N/A,Tidak
133,N/A,Zhafira Azka Ramadhani,5,seminggu lalu,"rasanya super duper banyakk dan enak enakk, pelayanannya juga sangat ramah, tempatnya bersih dan comfyy",N/A,Tidak
134,N/A,Atina Sabila Rahma,5,seminggu lalu,"Gelatonya enak, tempatnya nyaman, vibesnya kekinian, karyawannya ramah2 semua",N/A,Tidak
135,N/A,Azizah Puspo Sari,5,seminggu lalu,"pelayanannya sangat ramah, pas dikantong sesuai dengan porsinya👍👍👍 …",N/A,Tidak
136,N/A,alvina rahayu,5,seminggu lalu,banyak variant pelayanan baik dan ramah,N/A,Tidak
137,N/A,Jihan Yumaytha Almaas,5,seminggu lalu,rasa sangat pas tidak terlalu manis. vibes sangat cocok untuk nongkrong bersama teman2,N/A,Tidak
138,N/A,Galuh Zahwa,5,Diedit seminggu lalu,enak🫶🏻,N/A,Tidak
139,N/A,Raindras Dilla Arsa,5,seminggu lalu,pelayanannya bagus dan gelatonya enak banget🍦💖 …,N/A,Tidak
140,N/A,Cut Khansa Rayyna,5,seminggu lalu,"enak bgt apalagi varian earl grey pistachio nya, definitely kesini lg kalau ke jogja",N/A,Tidak
141,N/A,amelly raysa,5,seminggu lalu,N/A,N/A,Tidak
142,N/A,Shindy Cahyairani,5,seminggu lalu,"Tempatnya enak, pelayanannya oke, bersih dan nyaman banget, es creamnya enakk",N/A,Tidak
143,N/A,disap project,5,seminggu lalu,es krimnya enak bangettt⭐⭐⭐⭐⭐,N/A,Tidak
144,N/A,elvira wahyuni,5,seminggu lalu,Suka banget sama ice creamnya! Wajib kesini deh pokoknya,N/A,Tidak
145,N/A,Farrel Nayz,5,seminggu lalu,pelayan gercep & ramah,N/A,Tidak
146,N/A,Ardenta Nabila,5,seminggu lalu,"Kesini bbrp hari lalu ber2 cuma pen nyobain gelato nya. Abis 60an ber2. Overall enak dan banyak bgt pilihan rasanya ada kali itu 30an. Suka bgt pas dateng disambut meriah sama staff nya. Mood bgt 🥰💃❤ kataku klean cobain siii ini.

Tempat nya luas, aesthetic, ada smoking room nya. Dan ada photobox jg weh",N/A,Tidak
147,N/A,Robby Putranto,5,seminggu lalu,N/A,N/A,Tidak
148,N/A,Murwanti Didik,4,seminggu lalu,"Gelato enak si,untuk pesan kopi dan pastry harus sabar karena tidak ramai aja lama.americano hot dg gelas kertas jadi rembes dan kopi cepat dingin. Tidak disediakan gula",N/A,Tidak
149,N/A,Midnight Brew,5,seminggu lalu,"Rasanya Uenak..
Apalagi yang Dubai Pistachio dan Matcha Pistachio..
Mungkin sementara ini.. Ini masih yang paling enak..
Rasa yang Lain enak juga.. Mantap..

Cuma Musiknya aja yang kekencengan ..",N/A,Tidak
150,N/A,yerika cindy,5,seminggu lalu,"Pelayanannya ramah, tempatnya luas dan nyaman",N/A,Tidak
151,N/A,Mahe Bas,5,seminggu lalu,N/A,N/A,Tidak
152,N/A,Artini Herawati Wahyudi,5,2 minggu lalu,N/A,N/A,Tidak
153,N/A,fajar zona,5,2 minggu lalu,"Saya kesini pas Minggu pembukaan. Ramai banget. Namun pelayanannya tetap cepat. Terdapat aneka macam gelato. Tempatnya estetik dan khas nya C28, ada photobox nya. Promosi atau iklan nya juga termasuk agresif. Pas kesana saya lihat banyak juga pengunjung dari luar kota.",N/A,Tidak
154,N/A,Benedict Iyo,4,2 minggu lalu,N/A,N/A,Tidak
155,N/A,annisa luthfi,5,2 minggu lalu,"Tempat nya aesthetic, bagus dan nyaman bgt buat nongki",N/A,Tidak
156,N/A,Vera,5,2 minggu lalu,"Surga Gelato, banyak varian yang menggugah selera....ke Jogja wajib ke sini ya..",N/A,Tidak
157,N/A,Asa Shaliha Rahmaningrum,5,2 minggu lalu,"Saya suka gelatonya! Sebagai orang yang biasanya tidak suka hidangan penutup, gelato ini enak, tidak terlalu manis. Saya mencoba yang rasa teh susu panggang dan saya menyukainya! Saya datang jam 10 pagi dan rasa gelatonya cukup lengkap. Tempat ini cocok untuk nongkrong bersama teman-teman.",N/A,Tidak
158,N/A,Dewi Anugrah,5,2 minggu lalu,N/A,N/A,Tidak
159,N/A,Lutfi Jamal,5,2 minggu lalu,N/A,N/A,Tidak
160,N/A,Berliana Cahya,5,2 minggu lalu,N/A,N/A,Tidak
161,N/A,ellsa okktaa2772,5,2 minggu lalu,tempatnya seru baguss bgttt recomend,N/A,Tidak
162,N/A,Wibowo Budiharjo,5,2 minggu lalu,N/A,N/A,Tidak
163,N/A,Menik Zohara,5,2 minggu lalu,N/A,N/A,Tidak
